{
  "requirement_reference": "REQ-001",
  "summary": "create sample test case for facebook",
  "criteria": [
    {
      "id": "independent",
      "name": "Independent",
      "rating": "average",
      "rationale": "Requirement does not reference an external unstated dependency.",
      "improvement": "State any prerequisite explicitly, or split it out."
    },
    {
      "id": "negotiable",
      "name": "Negotiable",
      "rating": "very_good",
      "rationale": "Describes behaviour rather than a fixed implementation."
    },
    {
      "id": "valuable",
      "name": "Valuable",
      "rating": "bad",
      "rationale": "No beneficiary is named, so business value is implicit.",
      "improvement": "State who benefits and why."
    },
    {
      "id": "estimable",
      "name": "Estimable",
      "rating": "bad",
      "rationale": "No concrete limits, so effort cannot be sized confidently.",
      "improvement": "Add concrete limits, volumes or timeframes."
    },
    {
      "id": "small",
      "name": "Small",
      "rating": "very_good",
      "rationale": "Requirement is 6 words across 1 statements."
    },
    {
      "id": "testable",
      "name": "Testable",
      "rating": "average",
      "rationale": "No vague terms detected; outcomes look observable.",
      "improvement": "Replace vague wording with observable, checkable outcomes."
    },
    {
      "id": "acceptance_criteria",
      "name": "Acceptance Criteria",
      "rating": "bad",
      "rationale": "No explicit, enumerable acceptance criteria found.",
      "improvement": "Add an explicit acceptance criteria list."
    },
    {
      "id": "unambiguous",
      "name": "Unambiguous",
      "rating": "average",
      "rationale": "No ambiguous qualifiers detected.",
      "improvement": "Quantify every qualitative statement."
    }
  ],
  "overall": {
    "score": 2.12,
    "rating": "average",
    "verdict": "Mock heuristic scoring: average (2.12/4)."
  },
  "blocking_issues": [
    "No acceptance criteria: generated tests will rest on assumptions."
  ],
  "missing_information": [
    "No numeric limits, timeouts or volumes are stated.",
    "Generated by the mock engine: heuristic signals only, not reasoned analysis."
  ]
}