{
  "requirement_reference": "REQ-001",
  "summary": "REQ-001 As a user I must be able to log in with email and password.",
  "criteria": [
    {
      "id": "independent",
      "name": "Independent",
      "rating": "very_good",
      "rationale": "Requirement does not reference an external unstated dependency."
    },
    {
      "id": "negotiable",
      "name": "Negotiable",
      "rating": "very_good",
      "rationale": "Describes behaviour rather than a fixed implementation."
    },
    {
      "id": "valuable",
      "name": "Valuable",
      "rating": "very_good",
      "rationale": "Names an actor who benefits."
    },
    {
      "id": "estimable",
      "name": "Estimable",
      "rating": "very_good",
      "rationale": "Scope is bounded by concrete figures."
    },
    {
      "id": "small",
      "name": "Small",
      "rating": "very_good",
      "rationale": "Requirement is 32 words across 3 statements."
    },
    {
      "id": "testable",
      "name": "Testable",
      "rating": "very_good",
      "rationale": "No vague terms detected; outcomes look observable."
    },
    {
      "id": "acceptance_criteria",
      "name": "Acceptance Criteria",
      "rating": "average",
      "rationale": "No explicit, enumerable acceptance criteria found.",
      "improvement": "Add an explicit acceptance criteria list."
    },
    {
      "id": "unambiguous",
      "name": "Unambiguous",
      "rating": "very_good",
      "rationale": "No ambiguous qualifiers detected."
    }
  ],
  "overall": {
    "score": 3.75,
    "rating": "very_good",
    "verdict": "Mock heuristic scoring: very good (3.75/4)."
  },
  "blocking_issues": [],
  "missing_information": [
    "Generated by the mock engine: heuristic signals only, not reasoned analysis."
  ]
}