{
  "requirement_reference": "REQ-089",
  "summary": "REQ-089 Automated Merchant Refund Processing  Provide a multi-tier refund processing API for global ecommerce merchants.",
  "criteria": [
    {
      "id": "independent",
      "name": "Independent",
      "rating": "very_good",
      "rationale": "Requirement does not reference an external unstated dependency."
    },
    {
      "id": "negotiable",
      "name": "Negotiable",
      "rating": "very_good",
      "rationale": "Describes behaviour rather than a fixed implementation."
    },
    {
      "id": "valuable",
      "name": "Valuable",
      "rating": "average",
      "rationale": "No beneficiary is named, so business value is implicit.",
      "improvement": "State who benefits and why."
    },
    {
      "id": "estimable",
      "name": "Estimable",
      "rating": "very_good",
      "rationale": "Scope is bounded by concrete figures."
    },
    {
      "id": "small",
      "name": "Small",
      "rating": "very_good",
      "rationale": "Requirement is 76 words across 6 statements."
    },
    {
      "id": "testable",
      "name": "Testable",
      "rating": "very_good",
      "rationale": "No vague terms detected; outcomes look observable."
    },
    {
      "id": "acceptance_criteria",
      "name": "Acceptance Criteria",
      "rating": "average",
      "rationale": "No explicit, enumerable acceptance criteria found.",
      "improvement": "Add an explicit acceptance criteria list."
    },
    {
      "id": "unambiguous",
      "name": "Unambiguous",
      "rating": "very_good",
      "rationale": "No ambiguous qualifiers detected."
    }
  ],
  "overall": {
    "score": 3.5,
    "rating": "very_good",
    "verdict": "Mock heuristic scoring: very good (3.5/4)."
  },
  "blocking_issues": [],
  "missing_information": [
    "Generated by the mock engine: heuristic signals only, not reasoned analysis."
  ]
}