{
  "requirement_reference": "REQ-AUTH-204",
  "summary": "REQ-AUTH-204: Zero-Trust Step-Up Authentication",
  "criteria": [
    {
      "id": "independent",
      "name": "Independent",
      "rating": "very_good",
      "rationale": "Requirement does not reference an external unstated dependency."
    },
    {
      "id": "negotiable",
      "name": "Negotiable",
      "rating": "very_good",
      "rationale": "Describes behaviour rather than a fixed implementation."
    },
    {
      "id": "valuable",
      "name": "Valuable",
      "rating": "average",
      "rationale": "No beneficiary is named, so business value is implicit.",
      "improvement": "State who benefits and why."
    },
    {
      "id": "estimable",
      "name": "Estimable",
      "rating": "very_good",
      "rationale": "Scope is bounded by concrete figures."
    },
    {
      "id": "small",
      "name": "Small",
      "rating": "very_good",
      "rationale": "Requirement is 76 words across 7 statements."
    },
    {
      "id": "testable",
      "name": "Testable",
      "rating": "very_good",
      "rationale": "No vague terms detected; outcomes look observable."
    },
    {
      "id": "acceptance_criteria",
      "name": "Acceptance Criteria",
      "rating": "very_good",
      "rationale": "Enumerated pass/fail conditions are present."
    },
    {
      "id": "unambiguous",
      "name": "Unambiguous",
      "rating": "very_good",
      "rationale": "No ambiguous qualifiers detected."
    }
  ],
  "overall": {
    "score": 3.75,
    "rating": "very_good",
    "verdict": "Mock heuristic scoring: very good (3.75/4)."
  },
  "blocking_issues": [],
  "missing_information": [
    "Generated by the mock engine: heuristic signals only, not reasoned analysis."
  ]
}